{"content_sha256":"da576d0714bad98ddbd84bec13deba48a45ae41762ad71707c1ad29fc3f6bbad","member_key_fields":["publication_id","state_point_utc","prefix","afi"],"member_keys_digest":"1635a8f840177695721a8f3abed3afa45057d93fb2d6951c71c02a36e57a1eb9","members":[{"member_key":"p2s1_member_v1_0ea127d8d0ff58efff46a618c6e7a820ca4d01215fe3f5d780154eca6f853043","row_digest":"9bdabd7fdea42b292e5476083d7731762473cacaacef37dbce30d2e019ab66ac","row_ordinal":0},{"member_key":"p2s1_member_v1_ba975079f09dd7899408c362d9a084727b1b577909a1fea910271bd33150da7a","row_digest":"a15a6ac9a2286943e8c23ae87c9a10ed9697ff8abeea29abf043370c1b4b78f0","row_ordinal":1}],"population_id":"prefix_state_rows","publication_id":"publication_fixture_ir_1","schema_version":"country_outage_p2_s1_source_index_v1","secondary_indexes":{}}
