{"content_sha256":"012fcd9413a14644354fbc23c72f3b2f3b63262e286077e99cd684c2f63eb3af","member_key_fields":["publication_id","state_point_utc","asn"],"member_keys_digest":"bd60ac5f9f790caab80f5945293da46023d2ee704fe9411ef8eeeaa326fdb1a7","members":[{"member_key":"p2s1_member_v1_aeb8888d5587d9e36b20c558c92596050d2cea1c001b935871f93e080ffbf902","row_digest":"3b94cff4fa41c85e3be3ce02a61fa8f2f31660351fa491eb28bd7af7338948df","row_ordinal":0},{"member_key":"p2s1_member_v1_f30043dfa4c8362b5f1a8770febd471471fef1a9eb51787a068dc6598fc8b4d3","row_digest":"40ad922edd43db87096fbbf60fa867a667f11ed78abd51ebd4879756111480c6","row_ordinal":1}],"population_id":"asn_state_rows","publication_id":"publication_fixture_ir_1","schema_version":"country_outage_p2_s1_source_index_v1","secondary_indexes":{}}
