{"content_sha256":"c8519f775cbc78782a2ea4a070c9c47b521e13ad75a413215d893f389dec6fe5","member_key_fields":["publication_id","cohort_id","cohort_member_id"],"member_keys_digest":"b1d83444410094cac69cd9e2f9884d2fcfed443785132ab8ad42ee72b383ab82","members":[{"member_key":"p2s1_member_v1_801b49401f8b76789b8169225c598f01dd5bc2984f2be3b350eece44e050e9b7","row_digest":"32defd42a134d872712bc0a88347d1e2faf17090c18e2dc24de24caf4df67933","row_ordinal":0}],"population_id":"fixed_cohort_member_rows","publication_id":"publication_fixture_ir_1","schema_version":"country_outage_p2_s1_source_index_v1","secondary_indexes":{"source_population_binding":{"materialized_row_count":1,"source_population_complete":true,"source_population_content_digest":"2222222222222222222222222222222222222222222222222222222222222222","source_population_freeze_digest":"aaaaaaaaaaaaaaaaaaaaaaaaaaaaaaaaaaaaaaaaaaaaaaaaaaaaaaaaaaaaaaaa","source_population_manifest_digest":"1111111111111111111111111111111111111111111111111111111111111111","source_population_projection_cardinality":"one_to_one","source_population_record_refs":["cohort_fixture#manifest"],"source_population_row_count":1,"source_population_rows_digest":"79a4473d0c2c713dc6acf55a567e64ca9b122b90aeaa5d5f667e96f1c3d2e7eb","source_population_source_ref":"cohort_fixture"}}}
